{
  "project_name": "MyProject1",
  "platform": "android",
  "orientation": "portrait",
  "genre": "Hyper-casual survival / typing action",
  "summary": "A mobile survival typing game where letters spawn around the player and move inward. The player types matching letters to destroy them before they reach the player. The goal is to survive as long as possible.",
  "core_loop": "Enemy letter spawns, enemy moves toward player, player types matching letter, matching enemy is destroyed, more letters continue spawning, survive as long as possible.",
  "player_fantasy": "The player feels like they are defending themselves by typing quickly and accurately under pressure.",
  "input_model": {
    "type": "mobile keyboard input",
    "rules": [
      "letters typed must match enemy letter to destroy it",
      "input is immediate",
      "duplicate letters handled predictably"
    ]
  },
  "fail_condition": "A letter enemy reaches the player.",
  "score_model": "Primary score is survival time.",
  "difficulty_model": "Difficulty increases over time by shorter spawn intervals, slightly faster average movement, more overlapping pressure. For M1 only basic speed variation: slow letters, fast letters.",
  "scenes": [
    {
      "name": "Main Menu",
      "purpose": "Start screen with play button and title."
    },
    {
      "name": "Gameplay",
      "purpose": "Active gameplay where letters spawn and player types."
    },
    {
      "name": "Fail / Result Popup",
      "purpose": "Show survival time, retry and menu options."
    }
  ],
  "ui": {
    "screens": [
      "Main Menu",
      "Gameplay",
      "Fail / Result Popup"
    ],
    "hud_elements": [
      "survival time",
      "letters destroyed count (optional)",
      "status text (optional)"
    ],
    "layout_notes": [
      "Gameplay must reserve bottom screen space for the mobile keyboard.",
      "HUD should not overlap important enemy movement area.",
      "Fail popup should clearly show end of run and retry option.",
      "Keyboard active or quickly activatable.",
      "Central player position remains visible.",
      "Typed letter matching should feel obvious."
    ]
  },
  "entities": [
    {
      "name": "Player",
      "role": "center of screen, receives input",
      "behavior_notes": [
        "receives typed input",
        "checks for matching enemy"
      ]
    },
    {
      "name": "Enemy Letter",
      "role": "spawns around player, moves inward, has speed (slow/fast), may duplicate letters",
      "behavior_notes": [
        "moves toward player",
        "if reaches player triggers fail",
        "if matched by input, destroyed"
      ]
    }
  ],
  "systems": [
    "Input System",
    "Enemy Spawning System",
    "Movement System",
    "Scoring System",
    "Difficulty Scaling System"
  ],
  "out_of_scope": [
    "progression",
    "upgrades",
    "missions",
    "ads",
    "meta systems",
    "advanced enemy types beyond basic speed variation"
  ],
  "acceptance_criteria": [
    "typing feels responsive",
    "letters are readable",
    "screen layout works with mobile keyboard",
    "survival loop is understandable within seconds",
    "players want to retry for a better survival time"
  ],
  "open_questions": []
}